Cable Provider Name,Street Address,"City, State, Zip",Phone,Fax,Web Site,Comments
Cablevision,6 Corporate Center Drive,"Melville, NY 11747",(718) 617-3500,,http://www.optimum.com,
RCN Telecom Services of New York,100 Baltimore Drive,"Wilkes-Barre, PA 18702",800-RING-RCN (800-746-4726),,http://www.rcn.com,
Staten Island Cable,100 Cable Way,"Staten Island, NY 10303",(718) 816-8686,Fax: (718) 447-2638,http://www.timewarnercable.com,
Time Warner Cable of New York City (Citywide),46 East 23rd Street,"New York, NY 10010",(212) 358-0900,,http://www.timewarnercable.com,
Time Warner Cable of New York City (Brooklyn and Queens),4161 Kissena Boulevard,"Flushing, NY 11355",(718) 358-0900,,http://www.timewarnercable.com,
Verizon New York Inc.,,,1-800-VERIZON (1-800-837-4966),,http://www.verizon.com/fiostv,"To order Verizon FiOS cable service, for technical support, billing inquiries and customer care Call the Phone Number provided"
