Demographic,DBN,NAME,Total Cohort  - June,Total Math/ELA APM - June,% of Cohort - June,Total Cohort  - August,Total Math/ELA APM - August,% of Cohort - August
English Proficient,18K566,BROOKLYN GENERATION SCHOOL,4,s,s,4,s,s
English Proficient,18K567,BROOKLYN THEATRE ARTS HIGH SCHOOL,3,s,s,3,s,s
English Proficient,18K569,KURT HAHN EXPEDITIONARY LEARNING SCHO,4,s,s,4,s,s
English Proficient,18K576,VICTORY COLLEGIATE HIGH SCHOOL,3,s,s,3,s,s
English Proficient,18K578,BROOKLYN BRIDGE ACADEMY,86,0,0%,86,0,0%
English Proficient,18K589,ARTS & MEDIA PREPARATORY ACADEMY,4,s,s,4,s,s
English Proficient,18K629,CULTURAL ACADEMY FOR THE ARTS AND SCI,2,s,s,2,s,s
English Proficient,18K635,OLYMPUS ACADEMY,101,1,1%,101,1,1%
English Proficient,18K673,EAST BROOKLYN COMMUNITY HIGH SCHOOL,69,0,0%,69,1,1.4%
English Proficient,19K409,EAST NEW YORK FAMILY ACADEMY,91,6,6.6%,91,6,6.6%
English Proficient,19K420,FRANKLIN K. LANE HIGH SCHOOL,294,15,5.1%,294,15,5.1%
English Proficient,19K435,THOMAS JEFFERSON HIGH SCHOOL,1,s,s,1,s,s
English Proficient,19K502,FDNY HIGH SCHOOL FOR FIRE AND LIFE SA,81,3,3.7%,81,3,3.7%
English Proficient,19K504,HIGH SCHOOL FOR CIVIL RIGHTS,107,4,3.7%,107,4,3.7%
English Proficient,19K507,PERFORMING ARTS AND TECHNOLOGY HIGH S,108,4,3.7%,108,4,3.7%
English Proficient,19K510,WORLD ACADEMY FOR TOTAL COMMUNITY HEA,89,1,1.1%,89,5,5.6%
English Proficient,19K583,MULTICULTURAL HIGH SCHOOL,.,.,.,.,.,.
English Proficient,19K615,TRANSIT TECH CAREER AND TECHNICAL EDU,339,38,11.2%,339,40,11.8%
English Proficient,19K618,ACADEMY OF INNOVATIVE TECHNOLOGY,1,s,s,1,s,s
English Proficient,19K639,BROOKLYN LAB SCHOOL,1,s,s,1,s,s
English Proficient,19K659,CYPRESS HILLS COLLEGIATE PREPARATORY,93,5,5.4%,93,5,5.4%
English Proficient,19K660,W. H. MAXWELL CAREER AND TECHNICAL ED,217,6,2.8%,217,6,2.8%
English Proficient,20K445,NEW UTRECHT HIGH SCHOOL,487,139,28.5%,487,144,29.6%
English Proficient,20K485,HIGH SCHOOL OF  TELECOMMUNICATION ART,284,107,37.7%,284,108,38%
English Proficient,20K490,FORT HAMILTON HIGH SCHOOL,756,261,34.5%,756,267,35.3%
English Proficient,20K505,FRANKLIN DELANO ROOSEVELT HIGH SCHOOL,603,149,24.7%,603,153,25.4%
English Proficient,21K337,INTERNATIONAL HIGH SCHOOL AT LAFAYETTE,18,s,s,18,s,s
English Proficient,21K344,RACHEL CARSON HIGH SCHOOL FOR COASTAL,105,28,26.7%,105,28,26.7%
English Proficient,21K348,HIGH SCHOOL OF SPORTS MANAGEMENT,62,7,11.3%,62,7,11.3%
English Proficient,21K400,LAFAYETTE HIGH SCHOOL,39,4,10.3%,39,4,10.3%
English Proficient,21K410,ABRAHAM LINCOLN HIGH SCHOOL,519,87,16.8%,519,91,17.5%
English Proficient,21K525,EDWARD R. MURROW HIGH SCHOOL,874,367,42%,874,372,42.6%
English Proficient,21K540,JOHN DEWEY HIGH SCHOOL,528,113,21.4%,528,116,22%
English Proficient,21K559,LIFE ACADEMY HIGH SCHOOL FOR FILM AND,1,s,s,1,s,s
English Proficient,21K572,EXPEDITIONARY LEARNING SCHOOL FOR COM,3,s,s,3,s,s
English Proficient,21K620,WILLIAM E. GRADY CAREER AND TECHNICAL,275,9,3.3%,275,11,4%
English Proficient,21K690,BROOKLYN STUDIO SECONDARY SCHOOL,132,33,25%,132,33,25%
English Proficient,21K728,LIBERATION DIPLOMA PLUS,65,0,0%,65,0,0%
English Proficient,22K405,MIDWOOD HIGH SCHOOL,857,503,58.7%,857,523,61%
English Proficient,22K425,JAMES MADISON HIGH SCHOOL,1003,322,32.1%,1003,330,32.9%
English Proficient,22K495,SHEEPSHEAD BAY HIGH SCHOOL,437,23,5.3%,437,23,5.3%
English Proficient,22K535,LEON M. GOLDSTEIN HIGH SCHOOL FOR THE,253,203,80.2%,253,203,80.2%
English Proficient,22K555,BROOKLYN COLLEGE ACADEMY,120,40,33.3%,120,40,33.3%
English Proficient,23K493,BROOKLYN COLLEGIATE: A COLLEGE BOARD,68,6,8.8%,68,6,8.8%
English Proficient,23K514,FREDERICK DOUGLASS ACADEMY VII HIGH S,90,7,7.8%,90,7,7.8%
English Proficient,23K643,BROOKLYN DEMOCRACY ACADEMY,95,1,1.1%,95,1,1.1%
English Proficient,23K645,EBC/ENY HIGH SCHOOL FOR PUBLIC SAFETY,89,3,3.4%,89,3,3.4%
English Proficient,23K646,ASPIRATIONS DIPLOMA PLUS HIGH SCHOOL,110,1,0.9%,110,1,0.9%
English Proficient,23K647,METROPOLITAN DIPLOMA PLUS HIGH SCHOOL,96,2,2.1%,96,2,2.1%
English Proficient,23K697,TEACHERS PREPARATORY HIGH SCHOOL,95,24,25.3%,95,24,25.3%
English Proficient,24Q264,ACADEMY OF FINANCE AND  ENTERPRISE,85,12,14.1%,85,12,14.1%
English Proficient,24Q267,HIGH SCHOOL OF APPLIED COMMUNICATION,95,12,12.6%,95,12,12.6%
English Proficient,24Q296,PAN AMERICAN INTERNATIONAL HIGH SCHOO,.,.,.,.,.,.
English Proficient,24Q299,BARD HIGH SCHOOL EARLY COLLEGE II,50,26,52%,50,26,52%
English Proficient,24Q455,NEWTOWN HIGH SCHOOL,508,63,12.4%,508,66,13%
English Proficient,24Q485,GROVER CLEVELAND HIGH SCHOOL,544,101,18.6%,544,105,19.3%
English Proficient,24Q550,HIGH SCHOOL FOR ARTS AND BUSINESS,164,18,11%,164,18,11%
English Proficient,24Q560,ROBERT F. WAGNER  JR. SECONDARY SCHOO,93,22,23.7%,93,23,24.7%
English Proficient,24Q600,QUEENS VOCATIONAL AND TECHNICAL HIGH,264,29,11%,264,29,11%
English Proficient,24Q610,AVIATION CAREER & TECHNICAL EDUCATION,360,127,35.3%,360,134,37.2%
English Proficient,24Q744,VOYAGES PREPARATORY,77,2,2.6%,77,2,2.6%
English Proficient,25Q263,FLUSHING INTERNATIONAL HIGH SCHOOL,10,s,s,10,s,s
English Proficient,25Q281,EAST-WEST SCHOOL OF INTERNATIONAL STU,58,15,25.9%,58,15,25.9%
English Proficient,25Q285,WORLD JOURNALISM PREPARATORY: A COLLE,82,9,11%,82,9,11%
English Proficient,25Q425,JOHN BOWNE HIGH SCHOOL,478,55,11.5%,478,55,11.5%
English Proficient,25Q460,FLUSHING HIGH SCHOOL,440,40,9.1%,440,40,9.1%
English Proficient,25Q525,TOWNSEND HARRIS HIGH SCHOOL,278,276,99.3%,278,276,99.3%
English Proficient,25Q540,QUEENS ACADEMY HIGH SCHOOL,128,6,4.7%,128,6,4.7%
English Proficient,25Q670,ROBERT F. KENNEDY COMMUNITY HIGH SCHO,152,35,23%,152,35,23%
English Proficient,25Q792,NORTH QUEENS COMMUNITY HIGH SCHOOL,62,0,0%,62,0,0%
English Proficient,26Q415,BENJAMIN N. CARDOZO HIGH SCHOOL,932,447,48%,932,457,49%
English Proficient,26Q430,FRANCIS LEWIS HIGH SCHOOL,1070,535,50%,1070,571,53.4%
English Proficient,26Q435,MARTIN VAN BUREN HIGH SCHOOL,696,103,14.8%,696,103,14.8%
English Proficient,26Q495,BAYSIDE HIGH SCHOOL,828,439,53%,828,449,54.2%
English Proficient,26Q566,QUEENS HIGH SCHOOL OF TEACHING  LIBER,273,55,20.1%,273,55,20.1%
English Proficient,27Q260,FREDERICK DOUGLASS ACADEMY VI HIGH SC,93,11,11.8%,93,11,11.8%
English Proficient,27Q262,CHANNEL VIEW SCHOOL FOR RESEARCH,71,14,19.7%,71,14,19.7%
English Proficient,27Q302,QUEENS HIGH SCHOOL FOR INFORMATION  R,2,s,s,2,s,s
English Proficient,27Q400,AUGUST MARTIN HIGH SCHOOL,274,8,2.9%,274,8,2.9%
English Proficient,27Q410,BEACH CHANNEL HIGH SCHOOL,361,10,2.8%,361,10,2.8%
English Proficient,27Q465,FAR ROCKAWAY HIGH SCHOOL,128,4,3.1%,128,4,3.1%
English Proficient,27Q475,RICHMOND HILL HIGH SCHOOL,728,78,10.7%,728,80,11%
English Proficient,27Q480,JOHN ADAMS HIGH SCHOOL,706,60,8.5%,706,61,8.6%
English Proficient,27Q650,HIGH SCHOOL FOR CONSTRUCTION TRADES,176,39,22.2%,176,39,22.2%
English Proficient,28Q440,FOREST HILLS HIGH SCHOOL,874,362,41.4%,874,364,41.6%
English Proficient,28Q470,JAMAICA HIGH SCHOOL,327,27,8.3%,327,27,8.3%
English Proficient,28Q505,HILLCREST HIGH SCHOOL,660,98,14.8%,660,100,15.2%
English Proficient,28Q620,THOMAS A. EDISON CAREER AND TECHNICAL,812,352,43.3%,812,358,44.1%
English Proficient,28Q680,QUEENS GATEWAY TO HEALTH SCIENCES SEC,117,67,57.3%,117,71,60.7%
English Proficient,28Q687,QUEENS HIGH SCHOOL FOR THE SCIENCES A,107,100,93.5%,107,102,95.3%
English Proficient,28Q690,HIGH SCHOOL FOR LAW ENFORCEMENT AND P,125,16,12.8%,125,16,12.8%
English Proficient,29Q248,QUEENS PREPARATORY ACADEMY,90,8,8.9%,90,8,8.9%
English Proficient,29Q259,PATHWAYS COLLEGE PREPARATORY SCHOOL:,63,2,3.2%,63,2,3.2%
English Proficient,29Q265,EXCELSIOR PREPARATORY HIGH SCHOOL,86,5,5.8%,86,5,5.8%
English Proficient,29Q272,GEORGE WASHINGTON CARVER HIGH SCHOOL,102,28,27.5%,102,29,28.4%
English Proficient,29Q283,PREPARATORY ACADEMY FOR WRITERS: A CO,35,0,0%,35,0,0%
English Proficient,29Q492,MATHEMATICS  SCIENCE RESEARCH AND TEC,104,22,21.2%,104,22,21.2%
English Proficient,29Q494,LAW  GOVERNMENT AND COMMUNITY SERVICE,122,14,11.5%,122,14,11.5%
English Proficient,29Q496,BUSINESS  COMPUTER APPLICATIONS & ENT,113,1,0.9%,113,1,0.9%
English Proficient,29Q498,HUMANITIES & ARTS MAGNET HIGH SCHOOL,93,7,7.5%,93,7,7.5%
English Proficient,30Q445,WILLIAM CULLEN BRYANT HIGH SCHOOL,649,187,28.8%,649,195,30%
English Proficient,30Q450,LONG ISLAND CITY HIGH SCHOOL,603,124,20.6%,603,127,21.1%
English Proficient,30Q501,FRANK SINATRA SCHOOL OF THE ARTS HIGH SCHOOL,170,85,50%,170,86,50.6%
English Proficient,30Q502,INFORMATION TECHNOLOGY HIGH SCHOOL,245,46,18.8%,245,47,19.2%
English Proficient,30Q555,NEWCOMERS HIGH SCHOOL,23,13,56.5%,23,13,56.5%
English Proficient,30Q575,ACADEMY OF AMERICAN STUDIES,151,83,55%,151,85,56.3%
English Proficient,30Q580,BACCALAUREATE SCHOOL FOR GLOBAL EDUCA,70,56,80%,70,56,80%
English Proficient,31R047,CSI HIGH SCHOOL FOR INTERNATIONAL STU,80,19,23.8%,80,19,23.8%
English Proficient,31R080,THE MICHAEL J. PETRIDES SCHOOL,113,45,39.8%,113,45,39.8%
English Proficient,31R440,NEW DORP HIGH SCHOOL,485,100,20.6%,485,100,20.6%
English Proficient,31R445,PORT RICHMOND HIGH SCHOOL,494,80,16.2%,494,81,16.4%
English Proficient,31R450,CURTIS HIGH SCHOOL,605,129,21.3%,605,129,21.3%
English Proficient,31R455,TOTTENVILLE HIGH SCHOOL,1052,331,31.5%,1052,334,31.7%
English Proficient,31R460,SUSAN E. WAGNER HIGH SCHOOL,880,285,32.4%,880,286,32.5%
English Proficient,31R470,CONCORD HIGH SCHOOL,52,1,1.9%,52,1,1.9%
English Proficient,31R600,RALPH R. MCKEE CAREER AND TECHNICAL E,170,16,9.4%,170,16,9.4%
English Proficient,31R605,STATEN ISLAND TECHNICAL HIGH SCHOOL,288,282,97.9%,288,282,97.9%
English Proficient,32K403,ACADEMY FOR ENVIRONMENTAL LEADERSHIP,90,6,6.7%,90,7,7.8%
English Proficient,32K545,EBC HIGH SCHOOL FOR PUBLIC SERVICEBU,147,15,10.2%,147,15,10.2%
English Proficient,32K549,BUSHWICK SCHOOL FOR SOCIAL JUSTICE,89,6,6.7%,89,6,6.7%
English Proficient,32K552,ACADEMY OF URBAN PLANNING,105,4,3.8%,105,4,3.8%
English Proficient,32K554,ALL CITY LEADERSHIP SECONDARY SCHOOL,42,9,21.4%,42,10,23.8%
English Proficient,32K556,BUSHWICK LEADERS HIGH SCHOOL FOR ACAD,87,7,8%,87,7,8%
English Proficient,32K564,BUSHWICK COMMUNITY HIGH SCHOOL,126,0,0%,126,0,0%
Special Education,01M292,HENRY STREET SCHOOL FOR INTERNATIONAL,18,s,s,18,s,s
Special Education,01M448,UNIVERSITY NEIGHBORHOOD HIGH SCHOOL,25,1,4%,25,1,4%
Special Education,01M509,MARTA VALLE HIGH SCHOOL,13,s,s,13,s,s
Special Education,01M515,LOWER EAST SIDE PREPARATORY HIGH SCHO,1,s,s,1,s,s
Special Education,01M539,NEW EXPLORATIONS INTO SCIENCE  TECHNO,2,s,s,2,s,s
Special Education,01M650,CASCADES HIGH SCHOOL,2,s,s,2,s,s
Special Education,01M696,BARD HIGH SCHOOL EARLY COLLEGE,.,.,.,.,.,.
Special Education,02M047,47 THE AMERICAN SIGN LANGUAGE AND ENG,7,s,s,7,s,s
Special Education,02M288,FOOD AND FINANCE HIGH SCHOOL,18,s,s,18,s,s
Special Education,02M296,HIGH SCHOOL OF HOSPITALITY MANAGEMENT,8,s,s,8,s,s
Special Education,02M298,PACE HIGH SCHOOL,19,s,s,19,s,s
Special Education,02M300,URBAN ASSEMBLY SCHOOL OF DESIGN AND C,7,s,s,7,s,s
Special Education,02M305,URBAN ASSEMBLY ACADEMY OF GOVERNMENT,5,s,s,5,s,s
Special Education,02M308,LOWER MANHATTAN ARTS ACADEMY,17,s,s,17,s,s
Special Education,02M316,URBAN ASSEMBLY SCHOOL OF BUSINESS FOR YOUNG WOMEN,7,s,s,7,s,s
Special Education,02M374,GRAMERCY ARTS HIGH SCHOOL,12,s,s,12,s,s
Special Education,02M394,EMMA LAZARUS HIGH SCHOOL,.,.,.,.,.,.
Special Education,02M400,HIGH SCHOOL FOR ENVIRONMENTAL STUDIES,43,0,0%,43,0,0%
Special Education,02M408,PROFESSIONAL PERFORMING ARTS HIGH SCH,2,s,s,2,s,s
Special Education,02M411,BARUCH COLLEGE CAMPUS HIGH SCHOOL,3,s,s,3,s,s
Special Education,02M412,N.Y.C. LAB SCHOOL FOR COLLABORATIVE S,20,s,s,20,s,s
Special Education,02M414,N.Y.C. MUSEUM SCHOOL,17,s,s,17,s,s
Special Education,02M416,ELEANOR ROOSEVELT HIGH SCHOOL,1,s,s,1,s,s
Special Education,02M418,MILLENNIUM HIGH SCHOOL,10,s,s,10,s,s
Special Education,02M420,HIGH SCHOOL FOR HEALTH PROFESSIONS AN,19,s,s,19,s,s
Special Education,02M425,LEADERSHIP AND PUBLIC SERVICE HIGH SC,27,0,0%,27,0,0%
Special Education,02M440,BAYARD RUSTIN EDUCATIONAL COMPLEX,53,0,0%,53,0,0%
Special Education,02M460,WASHINGTON IRVING HIGH SCHOOL,67,0,0%,67,0,0%
Special Education,02M475,STUYVESANT HIGH SCHOOL,2,s,s,2,s,s
Special Education,02M489,HIGH SCHOOL OF ECONOMICS AND FINANCE,33,0,0%,33,0,0%
Special Education,02M500,UNITY CENTER FOR URBAN TECHNOLOGIES,8,s,s,8,s,s
Special Education,02M519,TALENT UNLIMITED HIGH SCHOOL,5,s,s,5,s,s
Special Education,02M520,MURRY BERGTRAUM HIGH SCHOOL FOR BUSIN,91,3,3.3%,91,3,3.3%
Special Education,02M529,JACQUELINE KENNEDY ONASSIS HIGH SCHOO,20,s,s,20,s,s
Special Education,02M531,REPERTORY COMPANY HIGH SCHOOL FOR THE,4,s,s,4,s,s
Special Education,02M542,MANHATTAN BRIDGES HIGH SCHOOL,.,.,.,.,.,.
Special Education,02M543,NEW DESIGN HIGH SCHOOL,28,0,0%,28,0,0%
Special Education,02M544,INDEPENDENCE HIGH SCHOOL,17,s,s,17,s,s
Special Education,02M545,HIGH SCHOOL FOR DUAL LANGUAGE AND ASI,1,s,s,1,s,s
Special Education,02M550,LIBERTY HIGH SCHOOL ACADEMY FOR NEWCO,3,s,s,3,s,s
Special Education,02M551,THE HARBOR HS,14,s,s,14,s,s
Special Education,02M575,MANHATTAN COMPREHENSIVE NIGHT AND DAY,8,s,s,8,s,s
Special Education,02M580,RICHARD R. GREEN HIGH SCHOOL OF TEACH,20,s,s,20,s,s
Special Education,02M586,HARVEY MILK HIGH SCHOOL,6,s,s,6,s,s
Special Education,02M600,THE HIGH SCHOOL OF FASHION INDUSTRIES,40,1,2.5%,40,1,2.5%
Special Education,02M615,CHELSEA CAREER AND TECHNICAL EDUCATIO,34,0,0%,34,0,0%
Special Education,02M620,NORMAN THOMAS HIGH SCHOOL,67,0,0%,67,0,0%
Special Education,02M625,HIGH SCHOOL OF GRAPHIC COMMUNICATION,79,0,0%,79,0,0%
Special Education,02M630,ART AND DESIGN HIGH SCHOOL,38,1,2.6%,38,1,2.6%
Special Education,02M655,LIFE SCIENCES SECONDARY SCHOOL,21,1,4.8%,21,1,4.8%
Special Education,03M283,MANHATTAN THEATRE LAB HIGH SCHOOL,13,s,s,13,s,s
Special Education,03M299,HIGH SCHOOL FOR ARTS  IMAGINATION AND,8,s,s,8,s,s
Special Education,03M307,URBAN ASSEMBLY SCHOOL FOR MEDIA STUDI,19,s,s,19,s,s
Special Education,03M404,INNOVATION DIPLOMA PLUS,3,s,s,3,s,s
Special Education,03M415,WADLEIGH SECONDARY SCHOOL FOR THE PER,23,0,0%,23,0,0%
Special Education,03M470,LOUIS D. BRANDEIS HIGH SCHOOL,64,1,1.6%,64,1,1.6%
Special Education,03M485,FIORELLO H. LAGUARDIA HIGH SCHOOL OF,6,s,s,6,s,s
Special Education,03M492,HIGH SCHOOL FOR LAW  ADVOCACY AND COM,26,0,0%,26,0,0%
Special Education,03M494,HIGH SCHOOL OF ARTS AND TECHNOLOGY,33,1,3%,33,1,3%
Special Education,03M505,EDWARD A. REYNOLDS WEST SIDE HIGH SCH,45,0,0%,45,0,0%
Special Education,03M541,MANHATTAN / HUNTER SCIENCE HIGH SCHOO,2,s,s,2,s,s
Special Education,03M860,FREDERICK DOUGLASS ACADEMY II SECONDA,11,s,s,11,s,s
Special Education,04M409,COALITION SCHOOL FOR SOCIAL CHANGE,24,0,0%,24,0,0%
Special Education,04M435,MANHATTAN CENTER FOR SCIENCE AND MATH,27,0,0%,27,0,0%
Special Education,04M495,PARK EAST HIGH SCHOOL,21,0,0%,21,0,0%
Special Education,04M610,YOUNG WOMEN'S LEADERSHIP SCHOOL,7,s,s,7,s,s
Special Education,04M635,ACADEMY OF ENVIRONMENTAL SCIENCE SECO,16,s,s,16,s,s
Special Education,04M680,HERITAGE SCHOOL  THE,21,0,0%,21,0,0%
Special Education,04M695,URBAN PEACE ACADEMY,7,s,s,7,s,s
Special Education,05M285,HARLEM RENAISSANCE HIGH SCHOOL,11,s,s,11,s,s
Special Education,05M304,MOTT HALL HIGH SCHOOL,16,s,s,16,s,s
Special Education,05M369,URBAN ASSEMBLY SCHOOL FOR THE PERFORM,8,s,s,8,s,s
Special Education,05M469,CHOIR ACADEMY OF HARLEM,4,s,s,4,s,s
Special Education,05M499,FREDERICK DOUGLASS ACADEMY,10,s,s,10,s,s
Special Education,05M670,THURGOOD MARSHALL ACADEMY FOR LEARNIN,13,s,s,13,s,s
Special Education,05M692,HIGH SCHOOL FOR MATHEMATICS  SCIENCE,2,s,s,2,s,s
Special Education,06M462,HIGH SCHOOL FOR INTERNATIONAL BUSINES,21,0,0%,21,0,0%
Special Education,06M463,HIGH SCHOOL FOR MEDIA AND COMMUNICATI,15,s,s,15,s,s
Special Education,06M467,HIGH SCHOOL FOR LAW AND PUBLIC SERVIC,21,0,0%,21,0,0%
Special Education,06M468,HIGH SCHOOL FOR HEALTH CAREERS AND SC,23,1,4.3%,23,1,4.3%
Special Education,06M540,A. PHILIP RANDOLPH CAMPUS HIGH SCHOOL,21,1,4.8%,21,1,4.8%
Special Education,06M552,GREGORIO LUPERON HIGH SCHOOL FOR SCIE,.,.,.,.,.,.
Special Education,07X221,SOUTH BRONX PREPARATORY: A COLLEGE BO,10,s,s,10,s,s
Special Education,07X321,CROTONA ACADEMY HIGH SCHOOL,3,s,s,3,s,s
Special Education,07X334,INTERNATIONAL COMMUNITY HIGH SCHOOL,1,s,s,1,s,s
Special Education,07X379,JILL CHAIFETZ TRANSFER HIGH SCHOOL,5,s,s,5,s,s
Special Education,07X381,BRONX HAVEN HIGH SCHOOL   ,.,.,.,.,.,.
Special Education,07X473,MOTT HAVEN VILLAGE PREPARATORY HIGH S,16,s,s,16,s,s
Special Education,07X500,HOSTOS-LINCOLN ACADEMY OF SCIENCE,.,.,.,.,.,.
Special Education,07X520,FOREIGN LANGUAGE ACADEMY OF GLOBAL ST,25,0,0%,25,0,0%
Special Education,07X527,BRONX LEADERSHIP ACADEMY II HS,17,s,s,17,s,s
Special Education,07X547,NEW EXPLORERS HIGH SCHOOL,13,s,s,13,s,s
Special Education,07X548,URBAN ASSEMBLY SCHOOL FOR CAREERS IN,11,s,s,11,s,s
Special Education,07X551,BRONX ACADEMY OF LETTERS,14,s,s,14,s,s
Special Education,07X600,ALFRED E. SMITH CAREER AND TECHNICAL,66,0,0%,66,0,0%
Special Education,07X655,SAMUEL GOMPERS CAREER AND TECHNICAL E,74,0,0%,74,0,0%
Special Education,07X670,HEALTH OPPORTUNITIES HIGH SCHOOL,12,s,s,12,s,s
Special Education,08X282,WOMEN'S ACADEMY OF EXCELLENCE,4,s,s,4,s,s
Special Education,08X293,RENAISSANCE HIGH SCHOOL FOR MUSICAL T,26,0,0%,26,0,0%
Special Education,08X295,GATEWAY SCHOOL FOR ENVIRONMENTAL RESE,25,0,0%,25,0,0%
Special Education,08X305,PABLO NERUDA ACADEMY FOR ARCHITECTURE,21,0,0%,21,0,0%
Special Education,08X312,MILLENNIUM ART ACADEMY,23,1,4.3%,23,1,4.3%
Special Education,08X332,HOLCOMBE L. RUCKER SCHOOL OF COMMUNIT,10,s,s,10,s,s
Special Education,08X377,BRONX COMMUNITY HIGH SCHOOL,10,s,s,10,s,s
Special Education,08X405,HERBERT H. LEHMAN HIGH SCHOOL,172,3,1.7%,172,4,2.3%
Special Education,08X450,ADLAI E. STEVENSON HIGH SCHOOL,7,s,s,7,s,s
Special Education,08X452,BRONX GUILD,14,s,s,14,s,s
Special Education,08X519,FELISA RINCON DE GAUTIER INSTITUTE FO,21,0,0%,21,0,0%
Special Education,08X540,SCHOOL FOR COMMUNITY RESEARCH AND LEA,20,s,s,20,s,s
Special Education,08X560,HIGH SCHOOL X560 - BRONX ACADEMY HIGH,18,s,s,18,s,s
Special Education,08X650,JANE ADDAMS HIGH SCHOOL FOR ACADEMIC,87,0,0%,87,0,0%
Special Education,08X686,NEW SCHOOL FOR ARTS AND SCIENCES,1,s,s,1,s,s
Special Education,09X227,BRONX EXPEDITIONARY LEARNING HIGH SCH,17,s,s,17,s,s
Special Education,09X231,EAGLE ACADEMY FOR YOUNG MEN,18,s,s,18,s,s
Special Education,09X239,URBAN ASSEMBLY ACADEMY FOR HISTORY AN,16,s,s,16,s,s
Special Education,09X250,EXIMIUS COLLEGE PREPARATORY ACADEMY:,4,s,s,4,s,s
Special Education,09X252,MOTT HALL BRONX HIGH SCHOOL,8,s,s,8,s,s
Special Education,09X260,BRONX CENTER FOR SCIENCE AND MATHEMAT,1,s,s,1,s,s
Special Education,09X263,VALIDUS PREPARATORY ACADEMY: AN EXPED,11,s,s,11,s,s
Special Education,09X276,LEADERSHIP INSTITUTE,6,s,s,6,s,s
Special Education,09X297,MORRIS ACADEMY FOR COLLABORATIVE STUD,24,0,0%,24,0,0%
Special Education,09X329,DREAMYARD PREPARATORY SCHOOL,8,s,s,8,s,s
Special Education,09X403,BRONX INTERNATIONAL HIGH SCHOOL,10,s,s,10,s,s
Special Education,09X404,SCHOOL FOR EXCELLENCE,20,s,s,20,s,s
Special Education,09X412,BRONX HIGH SCHOOL OF BUSINESS,25,0,0%,25,0,0%
Special Education,09X413,BRONX HIGH SCHOOL FOR MEDICAL SCIENCE,5,s,s,5,s,s
Special Education,09X414,JONATHAN LEVIN HIGH SCHOOL FOR MEDIA,24,0,0%,24,0,0%
Special Education,09X505,BRONX SCHOOL FOR LAW GOVERNMENT AND,17,s,s,17,s,s
Special Education,09X517,FREDERICK DOUGLASS ACADEMY III SECOND,15,s,s,15,s,s
Special Education,09X525,BRONX LEADERSHIP ACADEMY HIGH SCHOOL,26,1,3.8%,26,1,3.8%
Special Education,09X543,HIGH SCHOOL FOR VIOLIN AND DANCE,9,s,s,9,s,s
Special Education,10X141,RIVERDALE / KINGSBRIDGE ACADEMY (MIDD,7,s,s,7,s,s
Special Education,10X213,BRONX ENGINEERING AND TECHNOLOGY ACAD,10,s,s,10,s,s
Special Education,10X225,THEATRE ARTS PRODUCTION COMPANY SCHOO,9,s,s,9,s,s
Special Education,10X237,THE MARIE CURIE SCHOOL FOR MEDICINE,12,s,s,12,s,s
Special Education,10X243,WEST BRONX ACADEMY FOR THE FUTURE,15,s,s,15,s,s
Special Education,10X268,KINGSBRIDGE INTERNATIONAL HIGH SCHOOL,1,s,s,1,s,s
Special Education,10X284,BRONX SCHOOL OF LAW AND FINANCE,13,s,s,13,s,s
Special Education,10X319,PROVIDING URBAN LEARNERS SUCCESS IN E,10,s,s,10,s,s
Special Education,10X342,INTERNATIONAL SCHOOL FOR LIBERAL ARTS,1,s,s,1,s,s
Special Education,10X368,IN-TECH ACADEMY (M.S. / HIGH SCHOOL 3,14,s,s,14,s,s
Special Education,10X374,KNOWLEDGE AND POWER PREPARATORY ACADE,1,s,s,1,s,s
Special Education,10X397,ENGLISH LANGUAGE LEARNERS AND INTERNA,.,.,.,.,.,.
Special Education,10X433,HIGH SCHOOL FOR TEACHING AND THE PROF,18,s,s,18,s,s
Special Education,10X434,BELMONT PREPARATORY HIGH SCHOOL,16,s,s,16,s,s
Special Education,10X437,FORDHAM HIGH SCHOOL FOR THE ARTS,15,s,s,15,s,s
Special Education,10X438,FORDHAM LEADERSHIP ACADEMY FOR BUSINE,27,0,0%,27,0,0%
Special Education,10X439,BRONX HIGH SCHOOL FOR LAW AND COMMUNI,21,0,0%,21,0,0%
Special Education,10X440,DEWITT CLINTON HIGH SCHOOL,125,0,0%,125,0,0%
Special Education,10X442,CELIA CRUZ BRONX HIGH SCHOOL OF MUSIC,5,s,s,5,s,s
Special Education,10X445,BRONX HIGH SCHOOL OF SCIENCE,4,s,s,4,s,s
Special Education,10X475,JOHN F. KENNEDY HIGH SCHOOL,85,1,1.2%,85,1,1.2%
Special Education,10X477,MARBLE HILL HIGH SCHOOL FOR INTERNATI,10,s,s,10,s,s
Special Education,10X546,BRONX THEATRE HIGH SCHOOL,17,s,s,17,s,s
Special Education,10X549,DISCOVERY HIGH SCHOOL,15,s,s,15,s,s
Special Education,10X660,GRACE DODGE CAREER AND TECHNICAL EDUC,74,0,0%,74,0,0%
Special Education,10X696,HIGH SCHOOL OF AMERICAN STUDIES AT LE,2,s,s,2,s,s
Special Education,11X249,BRONX HEALTH SCIENCES HIGH SCHOOL,1,s,s,1,s,s
Special Education,11X253,BRONX HIGH SCHOOL FOR WRITING AND COM,17,s,s,17,s,s
Special Education,11X265,BRONX LAB SCHOOL,12,s,s,12,s,s
Special Education,11X270,ACADEMY FOR SCHOLARSHIP AND ENTRENEURSHIP,4,s,s,4,s,s
Special Education,11X275,HIGH SCHOOL OF COMPUTERS AND TECHNOLO,13,s,s,13,s,s
Special Education,11X288,COLLEGIATE INSTITUTE FOR MATH AND SCI,18,s,s,18,s,s
Special Education,11X290,BRONX ACADEMY OF HEALTH CAREERS,19,s,s,19,s,s
Special Education,11X299,ASTOR COLLEGIATE ACADEMY,25,0,0%,25,0,0%
Special Education,11X415,CHRISTOPHER COLUMBUS HIGH SCHOOL,78,0,0%,78,0,0%
Special Education,11X418,BRONX HIGH SCHOOL FOR THE VISUAL ARTS,26,2,7.7%,26,2,7.7%
Special Education,11X425,EVANDER CHILDS HIGH SCHOOL,.,.,.,.,.,.
Special Education,11X455,HARRY S TRUMAN HIGH SCHOOL,120,0,0%,120,0,0%
Special Education,11X513,NEW WORLD HIGH SCHOOL,.,.,.,.,.,.
Special Education,11X514,THE BRONXWOOD PREPARATORY ACADEMY,13,s,s,13,s,s
Special Education,11X541,GLOBAL ENTERPRISE HIGH SCHOOL,20,s,s,20,s,s
Special Education,11X542,PELHAM PREPARATORY ACADEMY,8,s,s,8,s,s
Special Education,11X544,HIGH SCHOOL FOR CONTEMPORARY ARTS,23,1,4.3%,23,1,4.3%
Special Education,11X545,BRONX AEROSPACE HIGH SCHOOL,16,s,s,16,s,s
Special Education,12X248,METROPOLITAN HIGH SCHOOL  THE,20,s,s,20,s,s
Special Education,12X251,EXPLORATIONS ACADEMY,6,s,s,6,s,s
Special Education,12X262,PERFORMANCE CONSERVATORY HIGH SCHOOL,21,0,0%,21,0,0%
Special Education,12X267,BRONX LATIN,.,.,.,.,.,.
Special Education,12X271,EAST BRONX ACADEMY FOR THE FUTURE,21,0,0%,21,0,0%
Special Education,12X278,PEACE AND DIVERSITY ACADEMY,15,s,s,15,s,s
Special Education,12X480,BRONX REGIONAL HIGH SCHOOL,14,s,s,14,s,s
Special Education,12X550,HIGH SCHOOL OF WORLD CULTURES,.,.,.,.,.,.
Special Education,12X680,BRONX COALITION COMMUNITY HIGH SCHOOL,21,0,0%,21,0,0%
Special Education,12X690,MONROE ACADEMY FOR BUSINESS/LAW,24,0,0%,24,0,0%
Special Education,12X692,MONROE ACADEMY FOR VISUAL ARTS & DESI,26,0,0%,26,0,0%
Special Education,13K265,DR. SUSAN S. MCKINNEY SECONDARY SCHOO,5,s,s,5,s,s
Special Education,13K350,URBAN ASSEMBLY HIGH SCHOOL OF MUSIC A,8,s,s,8,s,s
Special Education,13K412,BROOKLYN COMMUNITY HIGH SCHOOL OF COM,16,s,s,16,s,s
Special Education,13K419,SCIENCE SKILLS CENTER HIGH SCHOOL FOR,30,0,0%,30,0,0%
Special Education,13K430,BROOKLYN TECHNICAL HIGH SCHOOL,9,s,s,9,s,s
Special Education,13K483,THE URBAN ASSEMBLY SCHOOL FOR LAW AND,14,s,s,14,s,s
Special Education,13K499,ACORN COMMUNITY HIGH SCHOOL,28,0,0%,28,0,0%
Special Education,13K509,FREEDOM ACADEMY HIGH SCHOOL,13,s,s,13,s,s
Special Education,13K553,BROOKLYN ACADEMY HIGH SCHOOL,5,s,s,5,s,s
Special Education,13K575,BEDFORD STUYVESANT PREPARATORY HIGH S,1,s,s,1,s,s
Special Education,13K595,BEDFORD ACADEMY HIGH SCHOOL,5,s,s,5,s,s
Special Education,13K605,GEORGE WESTINGHOUSE CAREER AND TECHNI,45,0,0%,45,0,0%
Special Education,13K616,BROOKLYN HIGH SCHOOL FOR LEADERSHIP A,7,s,s,7,s,s
Special Education,13K670,BENJAMIN BANNEKER ACADEMY,17,s,s,17,s,s
Special Education,14K071,JUAN MOREL CAMPOS SECONDARY SCHOOL,21,0,0%,21,0,0%
Special Education,14K322,FOUNDATIONS ACADEMY,9,s,s,9,s,s
Special Education,14K404,ACADEMY FOR YOUNG WRITERS,6,s,s,6,s,s
Special Education,14K449,BROOKLYN LATIN SCHOOL  THE,.,.,.,.,.,.
Special Education,14K454,GREEN SCHOOL: AN ACADEMY FOR ENVIRONM,8,s,s,8,s,s
Special Education,14K474,PROGRESS HIGH SCHOOL FOR PROFESSIONAL,18,s,s,18,s,s
Special Education,14K477,SCHOOL FOR LEGAL STUDIES,15,s,s,15,s,s
Special Education,14K478,THE HIGH SCHOOL FOR ENTERPRISE  BUSIN,23,0,0%,23,0,0%
Special Education,14K488,BROOKLYN PREPARATORY HIGH SCHOOL,15,s,s,15,s,s
Special Education,14K558,WILLIAMSBURG HIGH SCHOOL FOR ARCHITEC,12,s,s,12,s,s
Special Education,14K561,WILLIAMSBURG PREPARATORY SCHOOL,18,s,s,18,s,s
Special Education,14K586,LYONS COMMUNITY SCHOOL,.,.,.,.,.,.
Special Education,14K610,AUTOMOTIVE HIGH SCHOOL,51,0,0%,51,0,0%
Special Education,15K027,AGNES Y. HUMPHREY SCHOOL FOR LEADERSH,1,s,s,1,s,s
Special Education,15K462,SECONDARY SCHOOL FOR LAW,10,s,s,10,s,s
Special Education,15K463,SECONDARY SCHOOL FOR JOURNALISM,11,s,s,11,s,s
Special Education,15K464,PARK SLOPE COLLEGIATE,13,s,s,13,s,s
Special Education,15K497,SCHOOL FOR INTERNATIONAL STUDIES,8,s,s,8,s,s
Special Education,15K498,ACORN HS FOR SOCIAL JUSTICE,18,s,s,18,s,s
Special Education,15K519,COBBLE HILL SCHOOL OF AMERICAN STUDIE,27,0,0%,27,0,0%
Special Education,15K520,PACIFIC HIGH SCHOOL,11,s,s,11,s,s
