Program Code,Program Name,DBN,Printed School Name,Interest Area,Selection Method,Selection Method Abbreviated,Directory Page #,Borough,URLS
Q25X,Flushing International High School,25Q263,Flushing International High School,Humanities & Interdisciplinary,Screened: Language,SL,422,Queens,http://schools.nyc.gov/Redirector.htm?Page=Admissions&loc=Q263
Q19J,Carl Sagan Science/Math Honors Academy,28Q440,Forest Hills High School,Science & Math,Screened,S,423,Queens,http://schools.nyc.gov/Redirector.htm?Page=Admissions&loc=Q440
Q19M,Law & Humanities Institute,28Q440,Forest Hills High School,Law & Government,Ed. Opt.,E,423,Queens,http://schools.nyc.gov/Redirector.htm?Page=Admissions&loc=Q440
Q19N,Drama Academy,28Q440,Forest Hills High School,Performing Arts,Audition,A,423,Queens,http://schools.nyc.gov/Redirector.htm?Page=Admissions&loc=Q440
Q19P,Academy of Instrumental Music/Performing Arts,28Q440,Forest Hills High School,Performing Arts,Audition,A,423,Queens,http://schools.nyc.gov/Redirector.htm?Page=Admissions&loc=Q440
Q19Z,Zoned,28Q440,Forest Hills High School,Zoned,Zoned,Z,423,Queens,http://schools.nyc.gov/Redirector.htm?Page=Admissions&loc=Q440
Q20A,Jacob K. Javits Law Institute,26Q430,Francis Lewis High School,Law & Government,Ed. Opt.,E,425,Queens,http://schools.nyc.gov/Redirector.htm?Page=Admissions&loc=Q430
Q20J,University Scholars,26Q430,Francis Lewis High School,Humanities & Interdisciplinary,Screened,S,425,Queens,http://schools.nyc.gov/Redirector.htm?Page=Admissions&loc=Q430
Q20K,Math and Science Research,26Q430,Francis Lewis High School,Science & Math,Screened,S,425,Queens,http://schools.nyc.gov/Redirector.htm?Page=Admissions&loc=Q430
Q20Z,Zoned,26Q430,Francis Lewis High School,Zoned,Zoned,Z,425,Queens,http://schools.nyc.gov/Redirector.htm?Page=Admissions&loc=Q430
Q40F,Film and Media Arts,30Q501,Frank Sinatra School of the Arts High School,Film/Video,Audition,A,427,Queens,http://schools.nyc.gov/Redirector.htm?Page=Admissions&loc=Q501
Q40J,Fine Arts,30Q501,Frank Sinatra School of the Arts High School,Visual Art & Design,Audition,A,427,Queens,http://schools.nyc.gov/Redirector.htm?Page=Admissions&loc=Q501
Q40K,Instrumental Music,30Q501,Frank Sinatra School of the Arts High School,Performing Arts,Audition,A,427,Queens,http://schools.nyc.gov/Redirector.htm?Page=Admissions&loc=Q501
Q40L,Vocal Music,30Q501,Frank Sinatra School of the Arts High School,Performing Arts,Audition,A,427,Queens,http://schools.nyc.gov/Redirector.htm?Page=Admissions&loc=Q501
Q40M,Dance,30Q501,Frank Sinatra School of the Arts High School,Performing Arts,Audition,A,427,Queens,http://schools.nyc.gov/Redirector.htm?Page=Admissions&loc=Q501
Q40N,Drama,30Q501,Frank Sinatra School of the Arts High School,Performing Arts,Audition,A,427,Queens,http://schools.nyc.gov/Redirector.htm?Page=Admissions&loc=Q501
Q75X,Frederick Douglass Academy VI High School,27Q260,Frederick Douglass Academy VI High School,Humanities & Interdisciplinary,Limited Unscreened,L,429,Queens,http://schools.nyc.gov/Redirector.htm?Page=Admissions&loc=Q260
Q45A,Veterinary Science Institute,29Q272,George Washington Carver High School for the Sciences,Animal Science,Limited Unscreened,L,430,Queens,http://schools.nyc.gov/Redirector.htm?Page=Admissions&loc=Q272
Q45C,Carver Research Institute,29Q272,George Washington Carver High School for the Sciences,Science & Math,Limited Unscreened,L,430,Queens,http://schools.nyc.gov/Redirector.htm?Page=Admissions&loc=Q272
Q23A,Academy of Information Technology (AoIT),24Q485,Grover Cleveland High School,Science & Math,Limited Unscreened,L,431,Queens,http://schools.nyc.gov/Redirector.htm?Page=Admissions&loc=Q485
Q23J,Math/Science Institute,24Q485,Grover Cleveland High School,Science & Math,Ed. Opt.,E,431,Queens,http://schools.nyc.gov/Redirector.htm?Page=Admissions&loc=Q485
Q23Z,Zoned,24Q485,Grover Cleveland High School,Zoned,Zoned,Z,431,Queens,http://schools.nyc.gov/Redirector.htm?Page=Admissions&loc=Q485
Q99A,Arts and Business,24Q550,High School for Arts and Business,Visual Art & Design,Ed. Opt.,E,432,Queens,http://schools.nyc.gov/Redirector.htm?Page=Admissions&loc=Q550
Q33A,High School for Community Leadership,28Q328,High School for Community Leadership,Humanities & Interdisciplinary,Limited Unscreened,L,433,Queens,http://schools.nyc.gov/Redirector.htm?Page=Admissions&loc=Q328
Q83A,Construction Trades & Management,27Q650,"High School for Construction Trades, Engineering and Architecture",Engineering,Screened,S,434,Queens,http://schools.nyc.gov/Redirector.htm?Page=Admissions&loc=Q650
Q83B,Architectural Design,27Q650,"High School for Construction Trades, Engineering and Architecture",Architecture,Screened,S,434,Queens,http://schools.nyc.gov/Redirector.htm?Page=Admissions&loc=Q650
Q83C,Academy of Engineering,27Q650,"High School for Construction Trades, Engineering and Architecture",Engineering,Screened,S,434,Queens,http://schools.nyc.gov/Redirector.htm?Page=Admissions&loc=Q650
Q21A,Law Enforcement and Public Safety,28Q690,High School for Law Enforcement and Public Safety,Law & Government,Screened,S,436,Queens,http://schools.nyc.gov/Redirector.htm?Page=Admissions&loc=Q690
Q07R,High School of Applied Communication,24Q267,High School of Applied Communication,Humanities & Interdisciplinary,Limited Unscreened,L,437,Queens,http://schools.nyc.gov/Redirector.htm?Page=Admissions&loc=Q267
Q24A,Health Careers Institute,28Q505,Hillcrest High School,Health Professions,Ed. Opt.,E,438,Queens,http://schools.nyc.gov/Redirector.htm?Page=Admissions&loc=Q505
Q24B,Teachers of Tomorrow,28Q505,Hillcrest High School,Teaching,Ed. Opt.,E,438,Queens,http://schools.nyc.gov/Redirector.htm?Page=Admissions&loc=Q505
Q24H,"School for the Humanities, Arts & Writing",28Q505,Hillcrest High School,Humanities & Interdisciplinary,Screened,S,438,Queens,http://schools.nyc.gov/Redirector.htm?Page=Admissions&loc=Q505
Q24J,Pre-Med Program,28Q505,Hillcrest High School,Health Professions,Screened,S,438,Queens,http://schools.nyc.gov/Redirector.htm?Page=Admissions&loc=Q505
Q24L,Theatre Arts,28Q505,Hillcrest High School,Performing Arts,Audition,A,438,Queens,http://schools.nyc.gov/Redirector.htm?Page=Admissions&loc=Q505
Q24P,Academy of Public Service and Law,28Q505,Hillcrest High School,Law & Government,Ed. Opt.,E,438,Queens,http://schools.nyc.gov/Redirector.htm?Page=Admissions&loc=Q505
Q24T,Biz/Tech,28Q505,Hillcrest High School,Business,Ed. Opt.,E,438,Queens,http://schools.nyc.gov/Redirector.htm?Page=Admissions&loc=Q505
Q24Z,Zoned,28Q505,Hillcrest High School,Zoned,Zoned,Z,438,Queens,http://schools.nyc.gov/Redirector.htm?Page=Admissions&loc=Q505
Q46A,Hillside Arts & Letters Academy,28Q325,Hillside Arts & Letters Academy,Humanities & Interdisciplinary,Limited Unscreened,L,440,Queens,http://schools.nyc.gov/Redirector.htm?Page=Admissions&loc=Q325
Q53A,Institute of the Performing & Media Arts,29Q498,Humanities & Arts Magnet High School,Performing Arts,Ed. Opt.,E,441,Queens,http://schools.nyc.gov/Redirector.htm?Page=Admissions&loc=Q498
Q53J,Institute of Visual Arts,29Q498,Humanities & Arts Magnet High School,Visual Art & Design,Audition,A,441,Queens,http://schools.nyc.gov/Redirector.htm?Page=Admissions&loc=Q498
Q22A,Information Technology,30Q502,Information Technology High School,Computer Science & Technology,Ed. Opt.,E,442,Queens,http://schools.nyc.gov/Redirector.htm?Page=Admissions&loc=Q502
Q27J,International High School at LaGuardia Community College,24Q530,International High School at LaGuardia Community College,Humanities & Interdisciplinary,Screened: Language,SL,443,Queens,http://schools.nyc.gov/Redirector.htm?Page=Admissions&loc=Q530
Q26G,Jamaica Gateway to the Sciences,28Q350,Jamaica Gateway to the Sciences,Science & Math,Ed. Opt.,E,444,Queens,http://schools.nyc.gov/Redirector.htm?Page=Admissions&loc=Q350
Q10A,Environmental and Science Research Institute,27Q480,John Adams High School,Engineering,Ed. Opt.,E,445,Queens,http://schools.nyc.gov/Redirector.htm?Page=Admissions&loc=Q480
Q10B,Law and International Studies Institute,27Q480,John Adams High School,Humanities & Interdisciplinary,Ed. Opt.,E,445,Queens,http://schools.nyc.gov/Redirector.htm?Page=Admissions&loc=Q480
Q10C,Health Careers,27Q480,John Adams High School,Health Professions,Ed. Opt.,E,445,Queens,http://schools.nyc.gov/Redirector.htm?Page=Admissions&loc=Q480
Q10D,Media & Communication Arts Institute,27Q480,John Adams High School,Communications,Ed. Opt.,E,445,Queens,http://schools.nyc.gov/Redirector.htm?Page=Admissions&loc=Q480
Q10E,Adams Business Institute,27Q480,John Adams High School,Business,Ed. Opt.,E,445,Queens,http://schools.nyc.gov/Redirector.htm?Page=Admissions&loc=Q480
Q10Z,Zoned,27Q480,John Adams High School,Zoned,Unscreened,Z,445,Queens,http://schools.nyc.gov/Redirector.htm?Page=Admissions&loc=Q480
Q14A,Center for Writing,25Q425,John Bowne High School,Communications,Ed. Opt.,E,447,Queens,http://schools.nyc.gov/Redirector.htm?Page=Admissions&loc=Q425
Q14B,Introduction to Agriculture,25Q425,John Bowne High School,Animal Science,Ed. Opt.,E,447,Queens,http://schools.nyc.gov/Redirector.htm?Page=Admissions&loc=Q425
Q14H,Science Research Program,25Q425,John Bowne High School,Science & Math,Screened,S,447,Queens,http://schools.nyc.gov/Redirector.htm?Page=Admissions&loc=Q425
Q14Z,Zoned,25Q425,John Bowne High School,Zoned,Unscreened,Z,447,Queens,http://schools.nyc.gov/Redirector.htm?Page=Admissions&loc=Q425
Q54A,"Law, Government and Community Service",29Q494,"Law, Government and Community Service High School",Law & Government,Ed. Opt.,E,449,Queens,http://schools.nyc.gov/Redirector.htm?Page=Admissions&loc=Q494
Q29H,West Queens Center for the Humanities and the Sciences,30Q450,Long Island City High School,Humanities & Interdisciplinary,Screened,S,450,Queens,http://schools.nyc.gov/Redirector.htm?Page=Admissions&loc=Q450
Q29J,Culinary Institute,30Q450,Long Island City High School,Culinary Arts,Screened,S,450,Queens,http://schools.nyc.gov/Redirector.htm?Page=Admissions&loc=Q450
Q29K,Opera Institute,30Q450,Long Island City High School,Performing Arts,Screened,S,450,Queens,http://schools.nyc.gov/Redirector.htm?Page=Admissions&loc=Q450
Q29L,Orchestra Academy,30Q450,Long Island City High School,Performing Arts,Screened,S,450,Queens,http://schools.nyc.gov/Redirector.htm?Page=Admissions&loc=Q450
Q29Z,Zoned,30Q450,Long Island City High School,Zoned,Zoned,Z,450,Queens,http://schools.nyc.gov/Redirector.htm?Page=Admissions&loc=Q450
Q38A,School of Business and Computer Studies,26Q435,Martin Van Buren High School,Business,Ed. Opt.,E,452,Queens,http://schools.nyc.gov/Redirector.htm?Page=Admissions&loc=Q435
Q38J,Center for Natural/Behavioral Sciences,26Q435,Martin Van Buren High School,Science & Math,Screened,S,452,Queens,http://schools.nyc.gov/Redirector.htm?Page=Admissions&loc=Q435
Q38Z,Zoned,26Q435,Martin Van Buren High School,Zoned,Unscreened,Z,452,Queens,http://schools.nyc.gov/Redirector.htm?Page=Admissions&loc=Q435
Q47A,Maspeth High School,24Q585,Maspeth High School,Humanities & Interdisciplinary,Limited Unscreened,L,453,Queens,http://schools.nyc.gov/Redirector.htm?Page=Admissions&loc=Q585
Q55A,Science Research,29Q492,"Mathematics, Science Research and Technology Magnet High School",Science & Math,Ed. Opt.,E,454,Queens,http://schools.nyc.gov/Redirector.htm?Page=Admissions&loc=Q492
Q49A,Metropolitan Expeditionary Learning School,28Q167,Metropolitan Expeditionary Learning School,Humanities & Interdisciplinary,Limited Unscreened,L,455,Queens,http://schools.nyc.gov/Redirector.htm?Page=Admissions&loc=Q167
Q30J,Middle College High School at LaGuardia Community College,24Q520,Middle College High School at LaGuardia Community College,Humanities & Interdisciplinary,Screened,S,456,Queens,http://schools.nyc.gov/Redirector.htm?Page=Admissions&loc=Q520
Q98A,Newcomers High School,30Q555,Newcomers High School,Humanities & Interdisciplinary,Screened: Language,SL,457,Queens,http://schools.nyc.gov/Redirector.htm?Page=Admissions&loc=Q555
Q34A,Business Institute,24Q455,Newtown High School,Business,Ed. Opt.,E,458,Queens,http://schools.nyc.gov/Redirector.htm?Page=Admissions&loc=Q455
Q34J,Pre-Engineering & Computer Technology,24Q455,Newtown High School,Engineering,Screened,S,458,Queens,http://schools.nyc.gov/Redirector.htm?Page=Admissions&loc=Q455
Q34K,Major Art,24Q455,Newtown High School,Visual Art & Design,Audition,A,458,Queens,http://schools.nyc.gov/Redirector.htm?Page=Admissions&loc=Q455
Q34Z,Zoned,24Q455,Newtown High School,Zoned,Zoned,Z,458,Queens,http://schools.nyc.gov/Redirector.htm?Page=Admissions&loc=Q455
Q03A,Pan American International High School,24Q296,Pan American International High School,Humanities & Interdisciplinary,Screened: Language,SL,460,Queens,http://schools.nyc.gov/Redirector.htm?Page=Admissions&loc=Q296
Q09R,"Pathways College Preparatory School, A College Board School",29Q259,Pathways College Preparatory School: A College Board School,Humanities & Interdisciplinary,Limited Unscreened,L,461,Queens,http://schools.nyc.gov/Redirector.htm?Page=Admissions&loc=Q259
Q84A,Preparatory Academy for Writers,29Q283,Preparatory Academy for Writers: A College Board School,Communications,Limited Unscreened,L,462,Queens,http://schools.nyc.gov/Redirector.htm?Page=Admissions&loc=Q283
Q05A,Queens Collegiate: A College Board School,28Q310,Queens Collegiate: A College Board School,Humanities & Interdisciplinary,Limited Unscreened,L,463,Queens,http://schools.nyc.gov/Redirector.htm?Page=Admissions&loc=Q310
Q57A,Queens Gateway to Health Sciences,28Q680,Queens Gateway to Health Sciences Secondary School,Health Professions,Screened,S,465,Queens,http://schools.nyc.gov/Redirector.htm?Page=Admissions&loc=Q680
Q06A,"Queens High School for Information, Research and Technology",27Q302,"Queens High School for Information, Research, and Technology",Science & Math,Limited Unscreened,L,466,Queens,http://schools.nyc.gov/Redirector.htm?Page=Admissions&loc=Q302
NO CODE,Queens High School for the Sciences at York College,28Q687,Queens High School for the Sciences at York College,Science & Math,Test,T,467,Queens,http://schools.nyc.gov/Redirector.htm?Page=Admissions&loc=Q687
Q32A,Teaching Institute,26Q566,"Queens High School of Teaching, Liberal Arts and the Sciences",Teaching,Ed. Opt.,E,468,Queens,http://schools.nyc.gov/Redirector.htm?Page=Admissions&loc=Q566
Q32B,Future Educators Academy,26Q566,"Queens High School of Teaching, Liberal Arts and the Sciences",Teaching,Limited Unscreened,L,468,Queens,http://schools.nyc.gov/Redirector.htm?Page=Admissions&loc=Q566
Q39Z,Zoned,28Q686,Queens Metropolitan High School,Zoned,Zoned,Z,469,Queens,http://schools.nyc.gov/Redirector.htm?Page=Admissions&loc=Q686
Q04R,Queens Preparatory Academy,29Q248,Queens Preparatory Academy,Science & Math,Limited Unscreened,L,470,Queens,http://schools.nyc.gov/Redirector.htm?Page=Admissions&loc=Q248
Q77A,Queens School of Inquiry,25Q252,The Queens School of Inquiry,Humanities & Interdisciplinary,Screened,S,471,Queens,http://schools.nyc.gov/Redirector.htm?Page=Admissions&loc=Q252
Q68A,Careers in Business,24Q600,Queens Vocational and Technical High School,Business,Screened,S,472,Queens,http://schools.nyc.gov/Redirector.htm?Page=Admissions&loc=Q600
Q68B,Graphic Arts,24Q600,Queens Vocational and Technical High School,Visual Art & Design,Screened,S,472,Queens,http://schools.nyc.gov/Redirector.htm?Page=Admissions&loc=Q600
Q68C,School of Skilled Building Trades,24Q600,Queens Vocational and Technical High School,Engineering,Screened,S,472,Queens,http://schools.nyc.gov/Redirector.htm?Page=Admissions&loc=Q600
Q68L,Pre-Engineering Electronic Technology,24Q600,Queens Vocational and Technical High School,Engineering,Screened,S,472,Queens,http://schools.nyc.gov/Redirector.htm?Page=Admissions&loc=Q600
Q68M,Exploratory: Introduction to Occupations,24Q600,Queens Vocational and Technical High School,Engineering,Ed. Opt.,E,472,Queens,http://schools.nyc.gov/Redirector.htm?Page=Admissions&loc=Q600
Q68N,Computer Technology and Information Systems,24Q600,Queens Vocational and Technical High School,Computer Science & Technology,Screened,S,472,Queens,http://schools.nyc.gov/Redirector.htm?Page=Admissions&loc=Q600
Q68O,Cosmetology Careers/Salon Management,24Q600,Queens Vocational and Technical High School,Cosmetology,Screened,S,472,Queens,http://schools.nyc.gov/Redirector.htm?Page=Admissions&loc=Q600
Q35B,Choices Academy,27Q475,Richmond Hill High School,Humanities & Interdisciplinary,Ed. Opt.,E,474,Queens,http://schools.nyc.gov/Redirector.htm?Page=Admissions&loc=Q475
Q35Z,Zoned,27Q475,Richmond Hill High School,Zoned,Zoned,Z,474,Queens,http://schools.nyc.gov/Redirector.htm?Page=Admissions&loc=Q475
Q70A,Community Service and Learning,25Q670,Robert F. Kennedy Community High School,Humanities & Interdisciplinary,Ed. Opt.,E,475,Queens,http://schools.nyc.gov/Redirector.htm?Page=Admissions&loc=Q670
Q31J,Arts and Technology for New Students,24Q560,"Robert F. Wagner, Jr. Secondary School for Arts and Technology",Humanities & Interdisciplinary,Ed. Opt.,E,476,Queens,http://schools.nyc.gov/Redirector.htm?Page=Admissions&loc=Q560
Q31K,Arts and Technology for Current Students,24Q560,"Robert F. Wagner, Jr. Secondary School for Arts and Technology",Humanities & Interdisciplinary,For Continuing 8th Graders,8,476,Queens,http://schools.nyc.gov/Redirector.htm?Page=Admissions&loc=Q560
Q02A,Robert H. Goddard High School of Communication,27Q308,Robert H. Goddard High School of Communication Arts and Technology,Communications,Limited Unscreened,L,477,Queens,http://schools.nyc.gov/Redirector.htm?Page=Admissions&loc=Q308
Q48A,Rockaway Collegiate High School,27Q351,Rockaway Collegiate High School,Humanities & Interdisciplinary,Limited Unscreened,L,478,Queens,http://schools.nyc.gov/Redirector.htm?Page=Admissions&loc=Q351
Q36A,Rockaway Park High School for Environmental Sustainability,27Q324,Rockaway Park High School for Environmental Sustainability,Humanities & Interdisciplinary,Limited Unscreened,L,479,Queens,http://schools.nyc.gov/Redirector.htm?Page=Admissions&loc=Q324
Q72A,Scholars' Academy,27Q323,Scholars' Academy,Humanities & Interdisciplinary,Screened,S,480,Queens,http://schools.nyc.gov/Redirector.htm?Page=Admissions&loc=Q323
Q67I,Commercial Art/Graphic Communications/Web Design,28Q620,Thomas A. Edison Career and Technical Education High School,Visual Art & Design,Screened,S,481,Queens,http://schools.nyc.gov/Redirector.htm?Page=Admissions&loc=Q620
Q67K,Information Technologies,28Q620,Thomas A. Edison Career and Technical Education High School,Computer Science & Technology,Screened,S,481,Queens,http://schools.nyc.gov/Redirector.htm?Page=Admissions&loc=Q620
Q67M,CAD/Mechanical Technology,28Q620,Thomas A. Edison Career and Technical Education High School,Engineering,Screened,S,481,Queens,http://schools.nyc.gov/Redirector.htm?Page=Admissions&loc=Q620
Q67N,Electrical Installation Technologies,28Q620,Thomas A. Edison Career and Technical Education High School,Engineering,Ed. Opt.,E,481,Queens,http://schools.nyc.gov/Redirector.htm?Page=Admissions&loc=Q620
Q67P,Automotive Technologies,28Q620,Thomas A. Edison Career and Technical Education High School,Engineering,Screened,S,481,Queens,http://schools.nyc.gov/Redirector.htm?Page=Admissions&loc=Q620
Q67S,Technical Electronics Engineering/Robotics,28Q620,Thomas A. Edison Career and Technical Education High School,Engineering,Screened,S,481,Queens,http://schools.nyc.gov/Redirector.htm?Page=Admissions&loc=Q620
Q67V,Med-Pharmaceutical/Bio-Technology,28Q620,Thomas A. Edison Career and Technical Education High School,Health Professions,Screened,S,481,Queens,http://schools.nyc.gov/Redirector.htm?Page=Admissions&loc=Q620
Q37J,Intensive Academic Humanities,25Q525,Townsend Harris High School,Humanities & Interdisciplinary,Screened,S,483,Queens,http://schools.nyc.gov/Redirector.htm?Page=Admissions&loc=Q525
Q15A,Mentor Law and Forensic Science Institute,30Q445,William Cullen Bryant High School,Law & Government,Screened,S,485,Queens,http://schools.nyc.gov/Redirector.htm?Page=Admissions&loc=Q445
Q15J,Math/Science Enrichment,30Q445,William Cullen Bryant High School,Science & Math,Screened,S,485,Queens,http://schools.nyc.gov/Redirector.htm?Page=Admissions&loc=Q445
Q15Z,Zoned,30Q445,William Cullen Bryant High School,Zoned,Unscreened,Z,485,Queens,http://schools.nyc.gov/Redirector.htm?Page=Admissions&loc=Q445
Q85A,World Journalism Preparatory,25Q285,World Journalism Preparatory: A College Board School,Communications,Limited Unscreened,L,487,Queens,http://schools.nyc.gov/Redirector.htm?Page=Admissions&loc=Q285
Q43A,York Early College Academy,28Q284,York Early College Academy,Humanities & Interdisciplinary,Screened,S,488,Queens,http://schools.nyc.gov/Redirector.htm?Page=Admissions&loc=Q284
Q56A,"The Young Women's Leadership School, Astoria",30Q286,"The Young Women's Leadership School, Astoria",Humanities & Interdisciplinary,Screened,S,489,Queens,http://schools.nyc.gov/Redirector.htm?Page=Admissions&loc=Q286
Q89A,"The Young Women's Leadership School, Queens",28Q896,"The Young Women's Leadership School, Queens",Humanities & Interdisciplinary,Screened,S,490,Queens,http://schools.nyc.gov/Redirector.htm?Page=Admissions&loc=Q896
R01R,CSI High School for International Studies,31R047,CSI High School for International Studies,Humanities & Interdisciplinary,Limited Unscreened,L,491,Staten Island,http://schools.nyc.gov/Redirector.htm?Page=Admissions&loc=R047
R19A,Computer Business Institute,31R450,Curtis High School,Computer Science & Technology,Unscreened,U,492,Staten Island,http://schools.nyc.gov/Redirector.htm?Page=Admissions&loc=R450
R19B,Legal Studies & Law Enforcement,31R450,Curtis High School,Law & Government,Unscreened,U,492,Staten Island,http://schools.nyc.gov/Redirector.htm?Page=Admissions&loc=R450
R19C,International Baccalaureate/Scholarship Honors Program,31R450,Curtis High School,Humanities & Interdisciplinary,Screened,S,492,Staten Island,http://schools.nyc.gov/Redirector.htm?Page=Admissions&loc=R450
R19D,Journalism Institute,31R450,Curtis High School,Communications,Unscreened,U,492,Staten Island,http://schools.nyc.gov/Redirector.htm?Page=Admissions&loc=R450
R19E,Naval Junior Reserve Officers' Training Corps,31R450,Curtis High School,JROTC,Ed. Opt.,E,492,Staten Island,http://schools.nyc.gov/Redirector.htm?Page=Admissions&loc=R450
R19F,Practical Nursing/Nursing Assistant/Medical Technology,31R450,Curtis High School,Health Professions,Screened,S,492,Staten Island,http://schools.nyc.gov/Redirector.htm?Page=Admissions&loc=R450
R19G,Performing Arts,31R450,Curtis High School,Performing Arts,Unscreened,U,492,Staten Island,http://schools.nyc.gov/Redirector.htm?Page=Admissions&loc=R450
R19H,School for International Services,31R450,Curtis High School,Humanities & Interdisciplinary,Screened,S,492,Staten Island,http://schools.nyc.gov/Redirector.htm?Page=Admissions&loc=R450
R19J,Visual Arts,31R450,Curtis High School,Visual Art & Design,Unscreened,U,492,Staten Island,http://schools.nyc.gov/Redirector.htm?Page=Admissions&loc=R450
R19Z,Zoned,31R450,Curtis High School,Zoned,Unscreened,Z,492,Staten Island,http://schools.nyc.gov/Redirector.htm?Page=Admissions&loc=R450
R55A,Gaynor McCown Expeditionary Learning School,31R064,Gaynor McCown Expeditionary Learning School,Humanities & Interdisciplinary,Limited Unscreened,L,494,Staten Island,http://schools.nyc.gov/Redirector.htm?Page=Admissions&loc=R064
R15J,Comprehensive Academic for New Students,31R080,The Michael J. Petrides School,Humanities & Interdisciplinary,Ed. Opt.,E,495,Staten Island,http://schools.nyc.gov/Redirector.htm?Page=Admissions&loc=R080
R15K,Comprehensive Academic for Current Students,31R080,The Michael J. Petrides School,Humanities & Interdisciplinary,For Continuing 8th Graders,8,495,Staten Island,http://schools.nyc.gov/Redirector.htm?Page=Admissions&loc=R080
R20A,Future Teachers Academy,31R440,New Dorp High School,Teaching,Ed. Opt.,E,496,Staten Island,http://schools.nyc.gov/Redirector.htm?Page=Admissions&loc=R440
R20C,"Law, History & Human Rights Institute sponsored by Gilder Lehrman Institute of American History",31R440,New Dorp High School,Law & Government,Screened,S,496,Staten Island,http://schools.nyc.gov/Redirector.htm?Page=Admissions&loc=R440
R20E,Corporate Center for Business and Technology,31R440,New Dorp High School,Business,Ed. Opt.,E,496,Staten Island,http://schools.nyc.gov/Redirector.htm?Page=Admissions&loc=R440
R20F,Allied Health Academy,31R440,New Dorp High School,Health Professions,Ed. Opt.,E,496,Staten Island,http://schools.nyc.gov/Redirector.htm?Page=Admissions&loc=R440
R20M,Academy of Communication and Media Arts,31R440,New Dorp High School,Communications,Ed. Opt.,E,496,Staten Island,http://schools.nyc.gov/Redirector.htm?Page=Admissions&loc=R440
R20P,Academy of Fine and Dramatic Arts,31R440,New Dorp High School,Performing Arts/Visual Art & Design,Ed. Opt.,E,496,Staten Island,http://schools.nyc.gov/Redirector.htm?Page=Admissions&loc=R440
R20S,Math & Science Health Careers Institute,31R440,New Dorp High School,Science & Math,Screened,S,496,Staten Island,http://schools.nyc.gov/Redirector.htm?Page=Admissions&loc=R440
R20T,Institute of Forensic Science and Criminology,31R440,New Dorp High School,Science & Math,Ed. Opt.,E,496,Staten Island,http://schools.nyc.gov/Redirector.htm?Page=Admissions&loc=R440
R20Z,Zoned,31R440,New Dorp High School,Zoned,Unscreened,Z,496,Staten Island,http://schools.nyc.gov/Redirector.htm?Page=Admissions&loc=R440
R10A,The Gateway Academy for Health,31R445,Port Richmond High School,Science & Math,Limited Unscreened,L,498,Staten Island,http://schools.nyc.gov/Redirector.htm?Page=Admissions&loc=R445
R10C,Culinary Arts,31R445,Port Richmond High School,Culinary Arts,Limited Unscreened,L,498,Staten Island,http://schools.nyc.gov/Redirector.htm?Page=Admissions&loc=R445
R10D,Junior Reserve Officers' Training Corps,31R445,Port Richmond High School,JROTC,Ed. Opt.,E,498,Staten Island,http://schools.nyc.gov/Redirector.htm?Page=Admissions&loc=R445
